{"type":"config","name":"Mint HTTP/1 hot paths","metricName":"total_us","metricUnit":"µs","bestDirection":"lower"}
{"run":1,"commit":"0bfcc86","metric":0,"metrics":{},"status":"crash","description":"Initial HTTP/1 hot-path autoresearch setup: first baseline failed due to benchmark script issues in request body attribute and header decoding corpus","timestamp":1773407804261,"segment":0}
{"run":2,"commit":"6a4df95","metric":99635,"metrics":{},"status":"keep","description":"Set up HTTP/1 hot-path autoresearch harness, focused checks, and baseline benchmark","timestamp":1773407854222,"segment":0}
{"run":3,"commit":"6a4df95","metric":100036,"metrics":{},"status":"discard","description":"Replace request header validation comprehensions with byte-recursive scans to cut allocations in Request.encode/4","timestamp":1773407897591,"segment":0}
{"run":4,"commit":"e3b98b9","metric":79753,"metrics":{},"status":"keep","description":"Cache lowercase strings for common atom header names in HTTP/1 response decoding","timestamp":1773407929200,"segment":0}
{"run":5,"commit":"e3b98b9","metric":0,"metrics":{},"status":"crash","description":"Try a manual ASCII content-length parser to replace trim-and-Integer.parse in HTTP/1 header parsing","timestamp":1773407966047,"segment":0}
{"run":6,"commit":"e3b98b9","metric":105458,"metrics":{},"status":"discard","description":"Replace content-length trim-plus-parse with a manual ASCII parser in Mint.HTTP1.Parse","timestamp":1773407993158,"segment":0}
{"run":7,"commit":"7a90baa","metric":79224,"metrics":{},"status":"keep","description":"Build connection and transfer-encoding tokens via byte lists instead of binary appends in HTTP/1 parsing","timestamp":1773408035703,"segment":0}
{"run":8,"commit":"5e5b5ad","metric":72448,"metrics":{},"status":"keep","description":"Restore the original header validators after confirming the recursive request-path rewrite was a regression","timestamp":1773408071897,"segment":0}
{"run":9,"commit":"df4b11d","metric":71552,"metrics":{},"status":"keep","description":"Encode HTTP/1 headers with a reversed iolist builder instead of nested Enum.reduce output","timestamp":1773408093481,"segment":0}
{"run":10,"commit":"df4b11d","metric":74182,"metrics":{},"status":"discard","description":"Replace String.downcase(:ascii) with a custom ASCII binary builder in header normalization","timestamp":1773408133396,"segment":0}
{"run":11,"commit":"d4865db","metric":71327,"metrics":{},"status":"keep","description":"Build HTTP/1 header iodata directly with recursive clauses instead of reversing an accumulator","timestamp":1773408184662,"segment":0}
{"run":12,"commit":"d4865db","metric":94214,"metrics":{},"status":"discard","description":"Fast-path content-length parsing by skipping trim_trailing unless the final byte is whitespace","timestamp":1773408236953,"segment":0}
{"run":13,"commit":"e8e9ba2","metric":69883,"metrics":{},"status":"keep","description":"Inline common HTTP/1 atom header mappings directly in Response.decode_header/1","timestamp":1773408295969,"segment":0}
{"run":14,"commit":"e8e9ba2","metric":73924,"metrics":{},"status":"discard","description":"Specialize Request.encode/4 for nil and :stream bodies to avoid the extra encode_body/1 hop","timestamp":1773408342715,"segment":0}
{"run":15,"commit":"e8e9ba2","metric":80301,"metrics":{},"status":"discard","description":"Split binary and uncommon-atom fallbacks in Response.decode_header/1 to avoid the generic helper dispatch","timestamp":1773408379080,"segment":0}
{"run":16,"commit":"e8e9ba2","metric":73052,"metrics":{},"status":"discard","description":"Inline request-line iodata in Request.encode/4 to remove the encode_request_line/2 helper call","timestamp":1773408410011,"segment":0}
{"run":17,"commit":"e8e9ba2","metric":72327,"metrics":{},"status":"discard","description":"Ask the compiler to inline downcase_ascii_char/1 in the HTTP/1 token parser","timestamp":1773408457152,"segment":0}
{"run":18,"commit":"c38643b","metric":61460,"metrics":{},"status":"keep","description":"Add exact-match fast paths for common connection and transfer-encoding header values before generic token parsing","timestamp":1773408560579,"segment":0}
{"run":19,"commit":"c38643b","metric":0,"metrics":{},"status":"crash","description":"Try compiled invalid-byte patterns for request header validation via binary.match/2","timestamp":1773408612253,"segment":0}
{"run":20,"commit":"c38643b","metric":0,"metrics":{},"status":"crash","description":"Retry compiled invalid-byte pattern validation; failed because compiled patterns are not escapable in module attributes","timestamp":1773408635266,"segment":0}
{"run":21,"commit":"c38643b","metric":63131,"metrics":{},"status":"discard","description":"Add a direct decode fast path for the binary header name X-Trace-Id in Response.decode_header/1","timestamp":1773408659899,"segment":0}
{"run":22,"commit":"c38643b","metric":0,"metrics":{},"status":"crash","description":"Try persistent-term cached compiled invalid-byte patterns for request header validation","timestamp":1773408725721,"segment":0}
{"run":23,"commit":"c38643b","metric":84521,"metrics":{},"status":"discard","description":"Use persistent-term cached compiled invalid-byte patterns plus binary.match/2 for request header validation","timestamp":1773408749055,"segment":0}
{"run":24,"commit":"c38643b","metric":0,"metrics":{},"status":"crash","description":"Try manual exact-prefix parsing for common response headers before falling back to decode_packet","timestamp":1773408834939,"segment":0}
{"run":25,"commit":"c38643b","metric":118296,"metrics":{},"status":"checks_failed","description":"Manual exact-prefix response header parsing regressed badly and broke 101 trailing-data handling by leaving CRLF in the remainder","timestamp":1773408862037,"segment":0}
{"run":26,"commit":"ab04d39","metric":52143,"metrics":{},"status":"keep","description":"Add exact-name validation fast paths for common HTTP request headers before falling back to bytewise checks","timestamp":1773408899665,"segment":0}
{"run":27,"commit":"6b1f66e","metric":51627,"metrics":{},"status":"keep","description":"Add exact-value validation fast paths for common generic header values like application/json and no-cache","timestamp":1773408931114,"segment":0}
{"run":28,"commit":"6b1f66e","metric":54723,"metrics":{},"status":"discard","description":"Special-case a few generic header name/value pairs directly in encode_headers/1 to skip validation calls","timestamp":1773408958185,"segment":0}
{"run":29,"commit":"6b1f66e","metric":0,"metrics":{},"status":"crash","description":"Try host-like ASCII fast paths for host and x-forwarded-for header value validation","timestamp":1773409052080,"segment":0}
{"run":30,"commit":"6b1f66e","metric":52496,"metrics":{},"status":"discard","description":"Use host-like ASCII fast paths for host and x-forwarded-for header value validation before generic fallback","timestamp":1773409071624,"segment":0}
{"run":31,"commit":"6b1f66e","metric":0,"metrics":{},"status":"crash","description":"Try fusing request line, headers, and trailer into one flatter iodata chain for Request.encode/4","timestamp":1773409148797,"segment":0}
{"run":32,"commit":"8c0226f","metric":50230,"metrics":{},"status":"keep","description":"Flatten Request.encode/4 and trailing-header encoding into one iodata chain with threaded header tails","timestamp":1773409201126,"segment":0}
{"run":33,"commit":"4eb0d96","metric":49993,"metrics":{},"status":"keep","description":"Specialize Request.encode/4 for nil and :stream bodies on top of the flattened threaded-iodata builder","timestamp":1773409251042,"segment":0}
{"run":34,"commit":"b35eaa9","metric":48572,"metrics":{},"status":"keep","description":"Specialize encode_headers/2 for common request header names so they skip separate name validation dispatch","timestamp":1773409321543,"segment":0}
{"run":35,"commit":"b35eaa9","metric":49972,"metrics":{},"status":"discard","description":"Re-test direct pair fast paths inside the specialized header encoder to skip value validation for a few common combinations","timestamp":1773409355917,"segment":0}
{"run":36,"commit":"b35eaa9","metric":49078,"metrics":{},"status":"discard","description":"Add a binary-name fast path for X-Trace-Id inside header_name/1 instead of in decode_header/1","timestamp":1773409389099,"segment":0}
{"run":37,"commit":"b35eaa9","metric":83600,"metrics":{},"status":"discard","description":"Replace generic request header validators with for-reduce scans to avoid building throwaway lists","timestamp":1773409444680,"segment":0}
{"run":38,"commit":"b35eaa9","metric":50039,"metrics":{},"status":"discard","description":"Validate outbound content-length values with Integer.parse/1 instead of the generic visible-ASCII scan","timestamp":1773409506478,"segment":0}
{"run":39,"commit":"b35eaa9","metric":52510,"metrics":{},"status":"discard","description":"Add tokenish fast-path validators for user-agent and x-request-id values before generic fallback","timestamp":1773409608152,"segment":0}
{"run":40,"commit":"b35eaa9","metric":53664,"metrics":{},"status":"discard","description":"Add a digit-only fast path for content-length value validation with generic fallback for unusual cases","timestamp":1773409645041,"segment":0}
{"run":41,"commit":"b35eaa9","metric":49910,"metrics":{},"status":"discard","description":"Re-test a single pair fast path for the longest common header pair: accept-encoding with gzip, deflate, br","timestamp":1773409708939,"segment":0}
{"type":"config","name":"Mint HTTP/2 request encoding hot paths","metricName":"total_us","metricUnit":"µs","bestDirection":"lower"}
{"run":1,"commit":"47ba773","metric":0,"metrics":{},"status":"crash","description":"Switch autoresearch target to HTTP/2 request encoding; first baseline failed because the synthetic benchmark reused depleted flow-control windows","timestamp":1773411575470,"segment":0}
{"run":2,"commit":"ae88233","metric":42150,"metrics":{},"status":"keep","description":"Switch autoresearch to HTTP/2 request encoding with a synthetic benchmark and focused HTTP/2 checks","timestamp":1773411602692,"segment":0}
{"run":3,"commit":"bc72033","metric":36819,"metrics":{},"status":"keep","description":"Skip pseudo-header sorting in HTTP/2 requests unless user-supplied pseudo-headers are actually present","timestamp":1773411656645,"segment":0}
{"run":4,"commit":"c2d1ff2","metric":32328,"metrics":{},"status":"keep","description":"Normalize request header names and detect user pseudo-headers in a single pass in HTTP/2.request/5","timestamp":1773411703961,"segment":0}
{"run":5,"commit":"7a79685","metric":30589,"metrics":{},"status":"keep","description":"Add common lowercase header-name fast paths to HTTP/2 request normalization","timestamp":1773411735540,"segment":0}
{"run":6,"commit":"7a79685","metric":31628,"metrics":{},"status":"discard","description":"Track user-agent and content-length presence during HTTP/2 request normalization to skip default-header list scans","timestamp":1773411787537,"segment":0}
{"run":7,"commit":"7a79685","metric":33814,"metrics":{},"status":"discard","description":"Replace the HTTP/2 request-header normalization reduce pipeline with a direct recursive loop","timestamp":1773411830800,"segment":0}
{"run":8,"commit":"7a79685","metric":31221,"metrics":{},"status":"discard","description":"Skip IO.iodata_to_binary in HTTP/2 DATA splitting when the request body is already a binary","timestamp":1773411900425,"segment":0}
{"run":9,"commit":"7a79685","metric":30879,"metrics":{},"status":"discard","description":"Use a binary fast path for default HTTP/2 content-length generation instead of IO.iodata_length/1","timestamp":1773411943154,"segment":0}
{"run":10,"commit":"6cbfb9e","metric":29135,"metrics":{},"status":"keep","description":"Add exact GET and POST pseudo-header assembly fast paths before the generic CONNECT-aware HTTP/2 path","timestamp":1773411987195,"segment":0}
{"run":11,"commit":"6cbfb9e","metric":31158,"metrics":{},"status":"discard","description":"Reorder HTTP/2 common header-name fast paths to favor the benchmark's most frequent names","timestamp":1773412017292,"segment":0}
{"run":12,"commit":"6cbfb9e","metric":31186,"metrics":{},"status":"discard","description":"Re-test skipping HTTP/2 default-header scans using tuple booleans from the normalization pass instead of a metadata map","timestamp":1773412080682,"segment":0}
{"run":13,"commit":"6cbfb9e","metric":33771,"metrics":{},"status":"discard","description":"Fold pseudo-header detection into HTTP/2 header normalization fast paths so common headers skip the starts-with-colon check","timestamp":1773412187538,"segment":0}
{"run":14,"commit":"6cbfb9e","metric":32889,"metrics":{},"status":"discard","description":"Replace Enum.map in HTTP/2 CONTINUATION frame assembly with direct recursion and a small end-headers helper","timestamp":1773412233093,"segment":0}
{"run":15,"commit":"6cbfb9e","metric":30432,"metrics":{},"status":"discard","description":"Skip String.downcase for arbitrary already-lowercase HTTP/2 header names by scanning only for uppercase ASCII first","timestamp":1773412283079,"segment":0}
